{
  "schema_version": "1.0",
  "run_id": "mysql-192.168.1.101-20260303T085500Z",
  "rule_version": "2.0",
  "generated_at": "2026-03-05T17:53:04.665905+08:00",
  "overall_risk": "medium",
  "counts": {
    "total_checks": 128,
    "normal": 25,
    "warning": 2,
    "critical": 0,
    "unevaluated": 101,
    "not_applicable": 0
  },
  "abnormal_items": [
    {
      "check_id": "4.13",
      "name": "等待事件 Top N",
      "dimension_id": "4",
      "dimension_name": "数据库性能",
      "level": "warning",
      "current_value": [
        {
          "event": "wait/io/file/innodb/innodb_log_file",
          "pct": 31.0
        },
        {
          "event": "wait/io/table/sql/handler",
          "pct": 28.0
        }
      ],
      "reason": "rows found",
      "advice": "根据 Top 等待事件针对性优化：I/O等待优化存储、锁等待优化SQL和索引"
    },
    {
      "check_id": "8.2",
      "name": "Top N 大表",
      "dimension_id": "8",
      "dimension_name": "存储与空间管理",
      "level": "warning",
      "current_value": [
        {
          "db": "order_db",
          "table": "orders",
          "size_gb": 120.0
        },
        {
          "db": "log_db",
          "table": "event_log",
          "size_gb": 98.0
        }
      ],
      "reason": "rows found",
      "advice": "对大表制定归档和清理策略；考虑分区表"
    }
  ],
  "unevaluated_items": [
    {
      "check_id": "1.5",
      "reason_type": "failed",
      "reason": "no data extracted from path: os.memory.samples[*].swap_in_per_sec",
      "source_module": "os"
    },
    {
      "check_id": "1.10",
      "reason_type": "failed",
      "reason": "no data extracted from path: os.system_info.file_descriptor_usage_percent",
      "source_module": "os"
    },
    {
      "check_id": "1.11",
      "reason_type": "failed",
      "reason": "no data extracted from path: os.system_info.mysql_fd_usage_percent",
      "source_module": "os"
    },
    {
      "check_id": "1.12",
      "reason_type": "failed",
      "reason": "no data extracted from path: os.system_info.oom_killer_detected",
      "source_module": "os"
    },
    {
      "check_id": "1.13",
      "reason_type": "failed",
      "reason": "no data extracted from path: os.system_info.numa_imbalance_percent",
      "source_module": "os"
    },
    {
      "check_id": "1.14",
      "reason_type": "failed",
      "reason": "no data extracted from path: os.system_info.transparent_hugepages",
      "source_module": "os"
    },
    {
      "check_id": "1.15",
      "reason_type": "failed",
      "reason": "no data extracted from path: os.system_info.ntp_offset_seconds",
      "source_module": "os"
    },
    {
      "check_id": "2.1",
      "reason_type": "failed",
      "reason": "no data extracted from path: db.replication.io_thread_running",
      "source_module": "db_replication"
    },
    {
      "check_id": "2.3",
      "reason_type": "failed",
      "reason": "no data extracted from path: db.replication.gtid_consistent",
      "source_module": "db_replication"
    },
    {
      "check_id": "2.4",
      "reason_type": "failed",
      "reason": "no data extracted from path: db.replication.semi_sync_status",
      "source_module": "db_replication"
    },
    {
      "check_id": "2.5",
      "reason_type": "failed",
      "reason": "no data extracted from path: db.replication.semi_sync_timeout_ms",
      "source_module": "db_replication"
    },
    {
      "check_id": "2.6",
      "reason_type": "failed",
      "reason": "no data extracted from path: db.replication.parallel_workers",
      "source_module": "db_replication"
    },
    {
      "check_id": "2.7",
      "reason_type": "failed",
      "reason": "no data extracted from path: db.replication.mgr.member_state",
      "source_module": "db_replication"
    },
    {
      "check_id": "2.8",
      "reason_type": "failed",
      "reason": "no data extracted from path: db.replication.mgr.consistency_level",
      "source_module": "db_replication"
    },
    {
      "check_id": "2.11",
      "reason_type": "failed",
      "reason": "no data extracted from path: db.replication.relay_log_space_bytes",
      "source_module": "db_replication"
    },
    {
      "check_id": "2.12",
      "reason_type": "failed",
      "reason": "no data extracted from path: db.replication.filter_rules",
      "source_module": "db_replication"
    },
    {
      "check_id": "3.1",
      "reason_type": "failed",
      "reason": "no data extracted from path: db.basic_info.is_alive",
      "source_module": "db_basic"
    },
    {
      "check_id": "3.2",
      "reason_type": "failed",
      "reason": "no data extracted from path: db.basic_info.uptime_seconds",
      "source_module": "db_basic"
    },
    {
      "check_id": "3.3",
      "reason_type": "failed",
      "reason": "no data extracted from path: db.basic_info.crash_recovery_detected",
      "source_module": "db_basic"
    },
    {
      "check_id": "3.4",
      "reason_type": "failed",
      "reason": "no data extracted from path: db.basic_info.is_connectable",
      "source_module": "db_basic"
    },
    {
      "check_id": "3.5",
      "reason_type": "failed",
      "reason": "no data extracted from path: db.basic_info.recent_errors",
      "source_module": "db_basic"
    },
    {
      "check_id": "3.7",
      "reason_type": "failed",
      "reason": "no data extracted from path: db.performance.connection_usage_percent",
      "source_module": "db_basic"
    },
    {
      "check_id": "3.8",
      "reason_type": "failed",
      "reason": "no data extracted from path: db.performance.aborted_connects",
      "source_module": "db_basic"
    },
    {
      "check_id": "4.3",
      "reason_type": "failed",
      "reason": "no data extracted from path: db.performance.slow_queries_count",
      "source_module": "db_perf"
    },
    {
      "check_id": "4.4",
      "reason_type": "failed",
      "reason": "no data extracted from path: db.sql_analysis.top_sql_by_time",
      "source_module": "db_perf"
    },
    {
      "check_id": "4.5",
      "reason_type": "failed",
      "reason": "no data extracted from path: db.sql_analysis.top_sql_explain",
      "source_module": "db_perf"
    },
    {
      "check_id": "4.6",
      "reason_type": "failed",
      "reason": "no data extracted from path: db.performance.full_scan_ratio",
      "source_module": "db_perf"
    },
    {
      "check_id": "4.7",
      "reason_type": "failed",
      "reason": "no data extracted from path: db.performance.innodb.buffer_pool_hit_ratio",
      "source_module": "db_perf"
    },
    {
      "check_id": "4.8",
      "reason_type": "failed",
      "reason": "no data extracted from path: db.performance.innodb.dirty_page_ratio",
      "source_module": "db_perf"
    },
    {
      "check_id": "4.9",
      "reason_type": "failed",
      "reason": "no data extracted from path: db.performance.thread_cache_hit_ratio",
      "source_module": "db_perf"
    },
    {
      "check_id": "4.10",
      "reason_type": "failed",
      "reason": "no data extracted from path: db.performance.opened_tables_per_second",
      "source_module": "db_perf"
    },
    {
      "check_id": "4.11",
      "reason_type": "failed",
      "reason": "no data extracted from path: db.performance.tmp_disk_table_ratio",
      "source_module": "db_perf"
    },
    {
      "check_id": "4.12",
      "reason_type": "failed",
      "reason": "no data extracted from path: db.performance.sort_merge_passes",
      "source_module": "db_perf"
    },
    {
      "check_id": "4.15",
      "reason_type": "failed",
      "reason": "no data extracted from path: db.performance.innodb.row_lock_time_avg_ms",
      "source_module": "db_perf"
    },
    {
      "check_id": "4.16",
      "reason_type": "failed",
      "reason": "no data extracted from path: db.config_check.performance_schema",
      "source_module": "db_perf"
    },
    {
      "check_id": "4.17",
      "reason_type": "failed",
      "reason": "no data extracted from path: db.sql_analysis.top_sql_by_count",
      "source_module": "db_perf"
    },
    {
      "check_id": "4.18",
      "reason_type": "failed",
      "reason": "no data extracted from path: db.sql_analysis.top_sql_by_rows_scanned",
      "source_module": "db_perf"
    },
    {
      "check_id": "4.19",
      "reason_type": "failed",
      "reason": "no data extracted from path: db.sql_analysis.full_scan_sqls",
      "source_module": "db_perf"
    },
    {
      "check_id": "4.20",
      "reason_type": "failed",
      "reason": "no data extracted from path: db.sql_analysis.no_index_sqls",
      "source_module": "db_perf"
    },
    {
      "check_id": "5.1",
      "reason_type": "failed",
      "reason": "no data extracted from path: db.security.root_remote_login",
      "source_module": "db_security"
    },
    {
      "check_id": "5.2",
      "reason_type": "failed",
      "reason": "no data extracted from path: db.security.empty_password_users",
      "source_module": "db_security"
    },
    {
      "check_id": "5.4",
      "reason_type": "failed",
      "reason": "no data extracted from path: db.security.password_expiry_days",
      "source_module": "db_security"
    },
    {
      "check_id": "5.5",
      "reason_type": "failed",
      "reason": "no data extracted from path: db.security.login_failure_lockout",
      "source_module": "db_security"
    },
    {
      "check_id": "5.6",
      "reason_type": "failed",
      "reason": "no data extracted from path: db.security.super_privilege_users",
      "source_module": "db_security"
    },
    {
      "check_id": "5.7",
      "reason_type": "failed",
      "reason": "no data extracted from path: db.security.all_db_privilege_users",
      "source_module": "db_security"
    },
    {
      "check_id": "5.8",
      "reason_type": "failed",
      "reason": "no data extracted from path: db.security.anonymous_users",
      "source_module": "db_security"
    },
    {
      "check_id": "5.9",
      "reason_type": "failed",